layer,neuron,score,explanation
16,1090,0.145673864, phrases related to locations and positions.
16,727,-0.061114946, words that signify change or progression in a situation or sequence of events.
16,557,0.166620001," phrases related to actions, events, or time-sensitive situations."
16,1581,0.178414815, compound words and connected phrases.
16,170,0.033834291, words associated with events or actions involving a sudden or forceful impact.
16,1358,0.170286743, phrases about possibilities and potential outcomes.
17,1776,0.093146546,"conjunctions, prepositions, and punctuation in a context of connecting phrases or ideas."
17,1659,-0.010904769, prepositions and related phrases indicating direction or position.
17,1490,-0.025325184,occupation-related nouns and their context.
17,1321,0.041394359, numbers and words related to quantity or amount.
17,1394,-0.001735688," partial words and locations mostly containing letters 'a', 'b', 'd' and 'n'."
17,1471,0.388181702, phrases related to opportunities and using power or abilities.
17,485,0.050197109, parts of words or phrases related to physical positions or connections.
17,326,0.108768777,partials of names or words that resemble names.
17,331,0.129288264,"words related to death, destruction, and negative outcomes."
17,1357,0.07545159, numerical values and expressions of quantities.
17,1563,-0.024521929, words related to possessions or ownership.
17,961,-0.017352309, words and phrases related to numbers and measurements.
17,1547,0.065575601, words related to specific objects or parts of an object.
17,224,0.071312262,a mix of different characters and uncommon letters or combinations.
17,201,0.045032581," phrases related to closeness, proximity, or being next to something or someone."
17,44,0.759208681," the word ""through"" and occasional related words indicating motion or transition."
17,837,0.03188041, words and phrases related to action or activity.
17,689,0.24734678, words and phrases related to central or focal points.
17,307,-0.004856465, numbers and related time expressions or measurements.
17,1463,0.157222621, transitional phrases indicating changes or new information.
18,338,-0.030749678, phrases indicating uncertainty or doubt.
18,1856,0.148164295, phrases related to a specific time or a historical context.
18,1894,0.119435161,phrases related to dividing or separating things into two distinct parts.
18,840,-0.072652857, numbers and words related to specific dates or events.
18,1011,0.174938497, phrases describing locations and positions within a space.
18,414,0.28709394," proper nouns, single letters, and numbers."
18,1965,0.130217785, combinations of two or more connected words or abbreviations.
18,38,-0.012217795,uppercase or capitalized letter combinations and small numbers.
18,1584,0.223564444, words and phrases indicating a sequence of events or specific timeframes.
18,853,0.063755369," combination of letters and numbers within words or phrases, often related to abbreviations or specific technical terms."
18,1270,0.003212053, phrases related to key moments or points in a situation or event.
18,1684,0.23478369, numbers and words related to counting or enumerating items.
18,444,0.216274008, words related to likes and preferences.
18,958,-0.049423098, comparative terms and related numerical values.
18,1946,0.019760259,phrases related to thinking and considering.
18,793,0.231288886, spatial relationships and the concept of distance or gaps.
18,1794,0.010373306, words and phrases related to events or gatherings.
18,1970,-0.025636464,locations or objects within a specific context or environment.
18,1141,0.301547853,"words and phrases related to determination, action, and taking steps towards a goal."
18,317,0.475505346, possessive structures and associated titles or entities.
19,802,0.508962228,"occurrences of the word ""define"" or its variants, in different contexts."
19,1603,0.130614228," words and punctuation marks indicating opposition, negation or disagreement."
19,1048,0.051010862, comparative phrases or words indicating differences.
19,140,0.018220699,"keywords related to health, food, and living conditions."
19,1887,0.053711839," words and phrases related to locations, positions, or preferences."
19,335,-0.039692191," action-related words, especially in the context of people or events happening."
19,92,0.227781009,"abbreviation, acronyms, and names."
19,1442,0.277961517," phrases related to asking questions, making requests, or offering options."
19,68,-0.045090456," partial words and symbols, especially punctuation marks and abbreviated parts of words."
19,518,0.026722085," words and phrases related to materials, structures, and forms."
19,1213,0.050574412," specific details, amounts, and conditions within various contexts."
19,698,0.310364294, question-related words and phrases.
19,1813,0.048528705, numbers or quantitative expressions with associated contextual information.
19,143,0.633693839," words and phrases related to opposition, conflict, and contrasting situations."
19,563,0.130495945," partial words or characters, focusing on specific endings or symbols."
19,1713,0.202836127, words and phrases related to sources of information.
19,1692,0.010996509, prepositions and numbers in context.
19,972,0.003049263," phrases related to development, progress, or changes."
19,664,0.198118627," specific points in time or moments, often involving numbers."
19,1951,0.271406118, temporal expressions or references to time.
20,491,0.073096199,"prepositions followed by words related to usage, legal, or intellectual property."
20,418,0.181233755, phrases related to personal experiences and realizations.
20,801,0.061183001, noun phrases with numerical values.
20,809,0.076125059," sequences of words related to a change, transformation, or transition."
20,487,0.289849856, numerical values and letters that are surrounded by non-alphanumeric characters.
20,1927,0.034061564,verbs and phrases related to motion and position.
20,837,0.088601586,"phrases indicating transitions or changes, particularly in time or circumstances."
20,1287,0.01856714,"words related to events, gatherings, and places of collaboration."
20,867,0.045049772," phrases indicating locations, progression or movement."
20,243,-0.004096627,"prepositions of relationships between items, numbers or concepts."
20,116,0.185895538, strings of numbers and/or string combinations of numbers and letters.
20,305,0.015914529, phrases related to quantities or measurements.
20,379,0.116809362, numbers and related ordinal indicators.
20,770,-0.010834786, numeric values or numbers within the text context.
20,1963,-0.055270646," words and phrases related to technical specifications, instructions, and options."
20,1401,0.088582033, comparative phrases related to frequency or intensity.
20,1039,0.339165386,proper nouns and notable people or organizations.
20,1219,0.334087209,phrases related to future possibilities or predictions.
20,1352,0.014858684, prepositions followed by adjectives or nouns.
20,1498,0.214382027," scientific and statistical language, including measurements and comparisons."
21,1090,0.099131789," relationships, specifically those involving locations, time, and connections between people or objects."
21,894,0.010944289," words related to connecting or linking concepts, items, or actions."
21,493,0.059804199,actions or situations involving effort or struggle.
21,1132,-0.002675196, combinations of numbers and short words or abbreviations.
21,309,-0.00421923, words and expressions related to intensity or extremity.
21,1958,0.124416142,sequences involving actions and their related objects or consequences.
21,1414,0.587950565," numerical codes and values involving sections, chapters, or parts."
21,1261,0.196835641, prepositions and their related nouns or noun phrases.
21,775,0.181321716, names and numbers related to geographical locations or administrative divisions.
21,1107,0.68514626, words and phrases related to gender and demographics.
21,897,-0.018559918, groups of nouns and their descriptive adjectives or quantities.
21,1645,0.058815669, words related to negative situations or issues.
21,946,0.064992269, technology-specific terms and names.
21,1160,0.07596001," apostrophes, short contractions, and spatial/time expressions."
21,119,0.017487868," words and phrases related to options, preferences, and decision-making."
21,862,-0.007362399," combinations of capital letters, numbers, and special characters in short phrases."
21,593,0.126828854, verbs related to taking action or making decisions.
21,1103,0.107583626, parts of words or two-letter combinations within words.
21,1620,-0.046703976, parts of words or phrases related to proper nouns or names.
21,714,0.263520598," pronouns and their corresponding verbs, focusing on identity and actions."
22,465,0.337224264, phrases expressing personal opinions or knowledge.
22,443,0.260402865, sequences of numbers and numerals.
22,1934,0.093637042, parts of names and prefixes or suffixes in names.
22,1558,0.175033314,words or phrases indicating a causal relationship or consequence.
22,1003,0.003754963, numerical values and values in a ranking or lists.
22,169,0.104381516,"equal signs, numbers, and punctuation in proximity to each other."
22,751,0.033261437, words and phrases related to contrasting or opposing concepts.
22,1662,-0.014635296, gender-related words and phrases or words indicating involvement.
22,481,0.007706479," words or phrases related to evaluations, ratings, or judgments."
22,886,0.11996652, suffixes and special characters in the text.
22,1454,0.349810583, prefixes or parts of words related to small measurements or units.
22,1796,0.22229704, numbers and related symbols in a sequence.
22,1753,0.036892339, prepositions and their related phrases.
22,1374,0.2301369," words and phrases related to significant achievements, qualifications, and recognitions."
22,1262,-0.01216259, phrases related to actions or processes.
22,183,0.003285161, words or phrases associated with change or transition.
22,1420,0.112521974, expressions of empathetic support and care.
22,1901,0.045481306, words related to medical conditions and health risks.
22,133,0.106201027, verbs followed by auxiliary verbs and accompanying objects.
22,1167,0.049099516, prepositions and related phrases indicating location or position.
23,1109,-0.046420359, words related to degrees of quantity or magnitude.
23,1730,0.125264147,"letters, numbers, and symbols in the middle of words or phrases."
23,325,0.059414895, relative positions or comparative statements.
23,1944,-0.059382849, single digit numbers and punctuations connected to single-word items.
23,1355,0.115765834, combinations of words that indicate a sequence or series of actions or events.
23,345,0.016825414, prepositions related to location and position.
23,419,0.106093582,"digits, dates, and numeric quantities."
23,264,0.014427234," words related to conditions, choices, or options."
23,392,0.1580194, adjectives and descriptive words in various contexts.
23,1703,0.092115281, prepositions and phrases indicating direction or position.
23,598,0.144312903, parts of phrases involving the process or result of losing something or someone.
23,1590,0.058954153, words related to creation or development processes.
23,1292,0.15352786, phrases for personal experiences and actions relative to time.
23,772,0.195251165," expressions of agreement, appreciation, or liking."
23,58,0.121347922, phrases and words related to technical processes or abilities.
23,1387,0.13370899," words and phrases indicating reasons, causes, and consequences."
23,1247,-0.021993452, words and phrases related to measurements and units.
23,25,-0.044373605, technical or specialized terms within a given context.
23,227,0.094432029, numbers and units of measurement.
23,1496,0.127956485, numerical values and words containing numbers or numerical concepts.
24,1996,0.150718292, words and phrases related to systems or processes.
24,695,0.02365145, prepositions followed by a word or phrase with a numeric or specific value.
24,1833,0.045880555, specific numbers or consecutive numerals.
24,1693,-0.033984359, words related to actions or decisions.
24,698,0.00760064, phrases related to negative outcomes or situations.
24,950,-0.02776266, words and phrases related to events and occurrences.
24,520,0.222880796, words with the letters 'ou' or 'old'.
24,979,-0.056988004, phrases related to movement and direction.
24,1403,0.035634626, words and phrases related to excitement and intensity.
24,914,0.025974084,numbers and related counting terms.
24,1335,0.235692347, words related to power and influence.
24,1442,0.117635536,"specific terms related to institutions and elements, often with capitalization."
24,1038,0.127550561," words related to conjunctions and prepositions connecting sentences, phrases, or words."
24,764,0.711041102," instances of work, worked, or working in various contexts."
24,138,-0.027797471, specific detail and examples within the text.
24,1037,0.188956467, expressions of uncertainty or doubt.
24,1257,0.512513347, words related to increases or upward movements.
24,1351,0.130641582, phrases showing cause and effect relationships.
24,1603,-0.054177141, words and phrases related to numerical values and time.
24,1186,0.193451776," web URLs, various settings, and related prefixes."
25,292,0.252848007,"comparative words, and values or rankings associated with them."
25,1048,0.038111261,age-related phrases and numbers.
25,1519,0.541605043," instances of words that include ""that"" and grammatical contractions with 's."
25,111,0.027321566, words or phrases related to numbers or numerical values.
25,1318,0.30424397,conjugations of verbs related to observing or experiencing events.
25,580,0.018815358," strings of numbers, symbols, and contractions."
25,1073,-0.022858035,words and phrases related to personal growth or progress.
25,1764,0.195997981, words related to singing and musical professions.
25,977,0.498650496," instances of prepositions, particularly ""by"" and ""of"", and their surrounding context."
25,903,0.281826034, dialogue or conversational text.
25,150,-0.04889866, specific names of people or places with a focus on geopolitical topics.
25,1966,0.035409394," words with internal and adjacent letter combinations 'ar' and 'ou', often representing parts of longer words."
25,1555,0.046443003, the possessive pronouns and contractions with a focus on location and attribution.
25,1845,-0.018650247," words related to force, pressure, or intensity."
25,83,0.223080942,"expressions of excitement, surprise, or receiving something."
25,747,-0.019930277, words related to numbers and stages in a sequence or process.
25,126,-0.021068227,participles and words that show strong action.
25,51,0.057498801," comparative phrases and examples, often with the use of ""like""."
25,1408,-0.01414371, phrases related to providing something or offering assistance.
25,1488,0.152273846, conjunctions and related punctuation in a sentence.
26,46,-0.078653945, numeric values and related punctuation.
26,1989,0.0558721, adjectives and descriptive phrases.
26,1021,0.009489293," phrases related to relationships, either among individuals or with objects."
26,640,0.217767786, auxiliary verbs related to forming and expressing predictions.
26,583,0.201361693, words related to change or alteration.
26,1239,0.152315504, location names and numbers.
26,906,0.025132346,sequences of detailed instructions or procedures.
26,1396,0.153581527, prepositions and related phrases indicating location or direction.
26,330,0.013901339,words and phrases related to technology and its applications.
26,128,0.10806947, time-related words and phrases.
26,1498,-0.010588079,conjunctions and related connecting words in various forms.
26,793,0.008996397, phrases related to positioning or locations in a context.
26,780,-0.046845714," numerals, prices, and relative status in collections or rankings."
26,35,0.075943669, words related to numbers and quantifiers.
26,981,0.009032072,"locations and related information, such as street names, cities, and countries."
26,306,0.279934172, words and phrases related to geographical locations and names.
26,764,-0.041015713, words and symbols with numerical or temporal significance.
26,1985,0.219421697,words and phrases related to team rankings and performance.
26,1524,0.357344768, parts of texts related to video games and their features.
26,535,0.042634479,descriptive words and abbreviations.
27,320,0.013470764, specific noun phrases and numbers.
27,1364,-0.021860251, parts of sentences where a connected series of words and punctuation is used to express the writer's flow of ideas or thoughts.
27,915,0.286608745, names and titles of people in various professional roles.
27,1807,-0.014390101,words and phrases related to stability and strength.
27,1341,0.048972208, words and phrases related to strong emotional reactions or states.
27,336,-0.003857322, prepositions and articles in association with certain nouns.
27,427,0.136662172, phrases related to comparisons or describing actions in contrast.
27,1237,0.053704214, words or parts of words with one or two letters.
27,541,0.168451325," nouns related to groups, systems, and resources."
27,458,0.047777133,words related to commitment or involvement in an action.
27,1709,-0.077973526,numbers and related actions or conditions involving those numbers.
27,861,0.05073445, phrases describing accomplishing or putting together something.
27,1304,0.341344217," words and phrases related to opinions, thoughts, and perspectives."
27,34,0.01584337, sequences of letters and numbers or formatted strings.
27,729,0.202692723, instances of possessive relationships and body parts.
27,710,0.262771735,letters or parts of words that indicate a scientific or technical concept.
27,403,0.517654916, phrases expressing a strong effort or intense thought.
27,1008,-0.046727504," numeric values, measurements, and related terms."
27,988,0.143655118, prepositions and their related word combinations.
27,213,0.012260702," single capital letters, pairs or groups of letters, and partial words."
28,1232,0.252009105," sentences ending with punctuation, particularly periods and exclamation marks."
28,1005,0.196105564, specific domain-related words and phrases.
28,1915,0.091489163,comparative phrases and structures that highlight differences or contrasts.
28,803,0.06791021, prepositions and their related contexts.
28,490,0.128629817, words and phrases indicating a sequence or a list.
28,869,0.365949941,parts of URLs or web-related text.
28,1783,0.043869989, phrases related to achieving or completing an action.
28,468,-0.02333199, phrases related to actions people do or numbers involved in a context.
28,1179,0.00913417, phrases related to progress or development.
28,1762,0.019382814, abbreviations and acronyms.
28,1600,0.087318048," numbers, rankings, and negative life events."
28,1485,-0.017691278, words or parts of words associated with actions or processes.
28,1117,-0.01119416," words and phrases related to a process, transition or change."
28,1425,0.265334608," parts of personal or proper names, especially Korean names."
28,754,0.338234307, phrases related to time or time progression.
28,411,0.567379683,words and phrases associated with dealing and coping with various situations and conditions.
28,1853,-0.059516882,"numbers and related units or context, including ranking, ratings, and comparisons."
28,1409,0.185633187, parts of words and syllables that contain the letter combination 'sc'.
28,1128,0.18616169, expressions of intensity and emphasis.
28,1797,0.223418191, words and phrases related to descriptions and definitions.
29,1198,0.032926474," parts of names, dates, and ordinal numbers."
29,251,0.154194668, possessive pronouns and their related objects or actions.
29,1471,0.120622973,sports-related terms and descriptions.
29,1724,0.364017501, informal or casual expressions of emotion.
29,612,0.020439132, significant nouns and pronoun references within a sentence.
29,1049,0.06511372, instances of conjunctions and numbers.
29,497,0.059442712, words and phrases related to creativity and building or making things.
29,155,0.166221087, numerical values and related context.
29,1627,-0.025562557, phrases related to opposition or challenging established ideas.
29,633,0.005244398, positional descriptions or directional phrases.
29,1601,-0.041262891, words and phrases representing progression or movement.
29,1414,-0.01189005," words or phrases related to artists, designers, and their creations."
29,449,0.007996709, comparative words and numeric values.
29,1117,0.155321052, phrases and sentences describing various bodily functions and processes.
29,1244,-0.05285584, words and phrases related to numbers and measurements.
29,1428,0.052311743, moments or points in time within text.
29,900,0.386340445," comparative expressions regarding size, age, or weight."
29,693,0.252590057, phrases related to staying connected or in touch.
29,1529,0.093058837," single digit numbers, punctuation marks, and small connecting words."
29,137,0.246833027, phrases related to ownership and responsibility.
30,1177,0.186298882, words ending with 's' and contractions.
30,849,-0.008320156, numbers and their units or related words.
30,1570,0.142579436, phrases with pronouns and verbs describing some form of action or condition.
30,762,0.045934488,prefixes and suffixes attached to words.
30,525,0.12603792, words and phrases related to physical closeness and contact.
30,1945,0.247784939,"prepositions followed by nouns describing objects, locations or body parts."
30,356,-0.020819763, words related to actions or events.
30,1154,0.016567697, sequences of words that imply a transition or change in situation.
30,1506,0.114447305, phrases related to caution and difficulty.
30,1040,0.384802016, words and phrases related to numerical order and counting.
30,1072,0.071046354, specialized terms and proper names within various fields or contexts.
30,945,0.266172869,phrases or words related to actions or movement.
30,149,-0.003980404, single syllable noun endings and numerical values.
30,169,0.088003247,"words and phrases related to taking action, making progress, or demonstrating personal abilities."
30,1968,-0.020370817, words and phrases related to doing something or involvement in a task.
30,603,0.048143366,"relationships, connections, and interactions between entities."
30,1585,0.046906037, specific details or quantifiable values.
30,414,-0.028968543, proper nouns and related industry terms within the context.
30,1719,0.053515744, prepositions and their related nouns.
30,934,-0.087256146, sequences of numbers and incremental progressions.
31,1905,0.038355459, numerical values and related technical terms.
31,74,0.120953553, words and phrases related to perception and understanding.
31,988,0.140343311, phrases related to transitions and progressions.
31,326,0.04813649, partial words and phrases related to numerical values.
31,839,0.254725251, phrases indicating improvement or positive changes.
31,167,0.113257011, words and phrases related to job positions and administrative roles.
31,51,-0.018184693,sequences of numbers and related events or statistics.
31,822,0.262586335, specific numerical values and related terms.
31,1078,0.08858763, comparative language and transition words.
31,1934,0.322507137, phrases indicating the progression or outcome of a situation.
31,999,0.246010188," phrases and words related to studies, research, and findings."
31,28,0.031496927,"actions or processes, often with a focus on determining or making decisions."
31,365,0.180117051, numbers and measurement-related words.
31,1236,-0.032913539, pronouns and their related clauses or objects.
31,234,0.105854032," verb phrases related to actions, movement, or activities."
31,844,0.0791434, words and phrases related to receiving help or benefits.
31,549,-0.020425723, expressions of emphasis and intensity.
31,1564,0.115552613, phrases related to comparisons and associations.
31,1563,0.063299757, numbers and words associated with counting or quantity.
31,1687,-0.035387915,specific numerical values and terms related to academics and educational programs.
32,1931,0.148488725, words indicating the presence or location of something or someone.
32,898,0.089765003, words and phrases related to criminal activity and legal consequences.
32,1820,0.396434526,verbs related to physical actions and movements.
32,1310,0.048982697, numbers and statistics in the text.
32,1056,-0.04343036, words related to objects and processes.
32,325,-0.014870152," instances of simple, step-by-step instructions or casual explanations."
32,596,0.03225517,names of people and parts of names.
32,1329,0.164398799, proper names of people and actions associated with them.
32,836,0.194348104,relations between members and groups or institutions.
32,776,0.054478934, phrases that express a motivational or determined attitude.
32,474,0.0982442,prepositions and related phrases.
32,1349,0.045911906, words and phrases related to legal situations and consequences.
32,881,0.190785655, parts of words or phrases related to actions and movements.
32,1176,0.127417728, phrases and words related to uncertain or unresolved situations.
32,1676,0.038056377, words and phrases indicating progression or change.
32,1371,-0.009478273, words related to connection and relationships.
32,773,0.14944522, words related to changes in physical states or conditions.
32,411,0.037787064,"position-related words, such as placement or direction."
32,1887,0.006724855, punctuation marks closely associated with numbers or locations.
32,1945,-0.026237814, numerical values and related words with numerical context.
33,164,0.050909887, specific numbers and measurements.
33,1511,0.188908173,legal and political terms or situations.
33,1966,0.103772814, numbers and text related to counting or measuring.
